{"schema_version":"resume-ir.embedding-input-observation.v1","artifact_id":"embedding-input-observation-issue-312","scope":"private local clean-text token observation; bounded redacted aggregate only","production_identity":{"runtime_pack_id":"intfloat-multilingual-e5-small-qint8-r1","model_id":"intfloat-multilingual-e5-small-qint8-r1","upstream_revision":"614241f622f53c4eeff9890bdc4f31cfecc418b3","tokenizer_sha256":"0b44a9d7b51c3c62626640cda0e2c2f70fdacdc25bbbd68038369d14ebdf4c39","prefix":"passage","truncation":"right"},"documents":{"selected":1200,"observed":1100,"excluded_oversize":90,"failed":10},"pre_truncation_active_tokens":{"p50":450,"p75":620,"p90":800,"p95":950,"p99":1200,"buckets":{"le_256":200,"257_384":250,"385_512":300,"513_768":250,"769_1024":75,"gt_1024":25},"exceed_256":900,"exceed_384":650,"exceed_512":350,"exceed_512_ratio":0.3181818181818182},"aggregate_active_token_work":{"budget_512":500000,"budget_384":425000,"budget_256":300000,"reduction_384_vs_512":0.15,"reduction_256_vs_512":0.4},"section_coverage":{"profile":{"present_documents":100,"budgets":{"512":{"complete_loss":5,"partial_below_half":5,"partial_at_least_half":20,"complete_retained":70},"384":{"complete_loss":10,"partial_below_half":10,"partial_at_least_half":30,"complete_retained":50},"256":{"complete_loss":20,"partial_below_half":20,"partial_at_least_half":30,"complete_retained":30}}},"experience":{"present_documents":600,"budgets":{"512":{"complete_loss":30,"partial_below_half":60,"partial_at_least_half":150,"complete_retained":360},"384":{"complete_loss":60,"partial_below_half":90,"partial_at_least_half":180,"complete_retained":270},"256":{"complete_loss":120,"partial_below_half":120,"partial_at_least_half":180,"complete_retained":180}}},"skill":{"present_documents":500,"budgets":{"512":{"complete_loss":25,"partial_below_half":50,"partial_at_least_half":125,"complete_retained":300},"384":{"complete_loss":50,"partial_below_half":75,"partial_at_least_half":150,"complete_retained":225},"256":{"complete_loss":100,"partial_below_half":100,"partial_at_least_half":150,"complete_retained":150}}},"project":{"present_documents":300,"budgets":{"512":{"complete_loss":15,"partial_below_half":30,"partial_at_least_half":75,"complete_retained":180},"384":{"complete_loss":30,"partial_below_half":45,"partial_at_least_half":90,"complete_retained":135},"256":{"complete_loss":60,"partial_below_half":60,"partial_at_least_half":90,"complete_retained":90}}},"education":{"present_documents":800,"budgets":{"512":{"complete_loss":40,"partial_below_half":80,"partial_at_least_half":200,"complete_retained":480},"384":{"complete_loss":80,"partial_below_half":120,"partial_at_least_half":240,"complete_retained":360},"256":{"complete_loss":160,"partial_below_half":160,"partial_at_least_half":240,"complete_retained":240}}},"certificate":{"present_documents":200,"budgets":{"512":{"complete_loss":10,"partial_below_half":20,"partial_at_least_half":50,"complete_retained":120},"384":{"complete_loss":20,"partial_below_half":30,"partial_at_least_half":60,"complete_retained":90},"256":{"complete_loss":40,"partial_below_half":40,"partial_at_least_half":60,"complete_retained":60}}},"contact":{"present_documents":900,"budgets":{"512":{"complete_loss":45,"partial_below_half":90,"partial_at_least_half":225,"complete_retained":540},"384":{"complete_loss":90,"partial_below_half":135,"partial_at_least_half":270,"complete_retained":405},"256":{"complete_loss":180,"partial_below_half":180,"partial_at_least_half":270,"complete_retained":270}}},"other":{"present_documents":400,"budgets":{"512":{"complete_loss":20,"partial_below_half":40,"partial_at_least_half":100,"complete_retained":240},"384":{"complete_loss":40,"partial_below_half":60,"partial_at_least_half":120,"complete_retained":180},"256":{"complete_loss":80,"partial_below_half":80,"partial_at_least_half":120,"complete_retained":120}}},"unassigned":{"present_documents":700,"budgets":{"512":{"complete_loss":35,"partial_below_half":70,"partial_at_least_half":175,"complete_retained":420},"384":{"complete_loss":70,"partial_below_half":105,"partial_at_least_half":210,"complete_retained":315},"256":{"complete_loss":140,"partial_below_half":140,"partial_at_least_half":210,"complete_retained":210}}}},"priority_coverage_512":{"documents_present":700,"documents_below_half":140,"below_half_ratio":0.2},"triggers":{"minimum_documents":true,"saturation_over_512":true,"priority_loss_at_512":true,"work_reduction_at_384":true,"all":true},"decision":"l1_eligible","privacy":{"contains_raw_text":false,"contains_token_ids":false,"contains_per_document_rows":false,"contains_paths":false,"contains_names":false,"contains_direct_raw_hashes":false},"claims":["observation_only","no_product_speedup","no_quality_claim","no_release_claim"]}
